<?xml version="1.0"?>
<?xml-stylesheet href="../stylesheets/WitsmlEnumList.xsl" type="text/xsl" media="screen"?>

<!--
This file is distributed under the POSC License Agreement at
http://www.posc.org/about/license.shtml.
Use of this file constitutes agreement with the POSC License Agreement.
-->

<enumListSet 
	xmlns="http://www.witsml.org/schemas/131" 
	xmlns:xsi="http://www.w3.org/2001/XMLSchema-instance" 
	xsi:schemaLocation="http://www.witsml.org/schemas/131 
			   ../cs_enumValues.xsd" 
	version="1.3.1.1">
	<enumList>
		<name>ActivityCode</name>
		<description>Activity codes.</description>
		<namingSystem>WITSML</namingSystem>
		<value>
			<name>abandonment</name>
			<description>abandonment</description>
		</value>
		<value>
			<name>abandonment -- log plugs</name>
			<description>A specialization of 'abandonment'.</description>
		</value>
		<value>
			<name>abandonment -- run plugs</name>
			<description>A specialization of 'abandonment'.</description>
		</value>
		<value>
			<name>abandonment -- wait on cement</name>
			<description>A specialization of 'abandonment'.</description>
		</value>
		<value>
			<name>casing, cement</name>
			<description>casing and cement</description>
		</value>
		<value>
			<name>casing, cement -- circulate, cement</name>
			<description>A specialization of 'casing, cement': circulate and cement</description>
		</value>
		<value>
			<name>casing, cement -- other</name>
			<description>A specialization of 'casing, cement'.</description>
		</value>
		<value>
			<name>casing, cement -- rig up, run casing</name>
			<description>A specialization of 'casing, cement': rig up and run casing</description>
		</value>
		<value>
			<name>casing, cement -- rig up, run liner</name>
			<description>A specialization of 'casing, cement': rig up and run liner</description>
		</value>
		<value>
			<name>casing, cement -- wait on cement</name>
			<description>A specialization of 'casing, cement'.</description>
		</value>
		<value>
			<name>completion operations</name>
			<description>After reaching total depth, any operations for completing the well and bringing it on production - no further detail is known.</description>
		</value>
		<value>
			<name>completion operations -- rig up</name>
			<description>Rig up completion equipment.</description>
		</value>
		<value>
			<name>completion operations -- tear down</name>
			<description>Tear down completion equipment.</description>
		</value>
		<value>
			<name>completion operations -- testing </name>
			<description>Pre-production flow testing in the well completion phase.</description>
		</value>
		<value>
			<name>completion operations -- running liner</name>
			<description>Running the production liner.</description>
		</value>
		<value>
			<name>completion operations -- gravel packing</name>
			<description>Completion operation for producing zones.</description>
		</value>
		<value>
			<name>completion operations -- logging</name>
			<description>Production logging tool runs.</description>
		</value>
		<value>
			<name>cond mud, circulate</name>
			<description>condition mud and circulate</description>
		</value>
		<value>
			<name>cond mud, circulate -- boulder or gravel</name>
			<description>A specialization of 'cond mud, circulate'.</description>
		</value>
		<value>
			<name>cond mud, circulate -- casing</name>
			<description>A specialization of 'cond mud, circulate'.</description>
		</value>
		<value>
			<name>cond mud, circulate -- cementing</name>
			<description>A specialization of 'cond mud, circulate'.</description>
		</value>
		<value>
			<name>cond mud, circulate -- circulate samples</name>
			<description>A specialization of 'cond mud, circulate'.</description>
		</value>
		<value>
			<name>cond mud, circulate -- coring</name>
			<description>A specialization of 'cond mud, circulate'.</description>
		</value>
		<value>
			<name>cond mud, circulate -- drilling</name>
			<description>A specialization of 'cond mud, circulate'.</description>
		</value>
		<value>
			<name>cond mud, circulate -- fishing</name>
			<description>A specialization of 'cond mud, circulate'.</description>
		</value>
		<value>
			<name>cond mud, circulate -- gumbo attack</name>
			<description>A specialization of 'cond mud, circulate'.</description>
		</value>
		<value>
			<name>cond mud, circulate -- logging</name>
			<description>A specialization of 'cond mud, circulate'.</description>
		</value>
		<value>
			<name>cond mud, circulate -- lost circulation</name>
			<description>A specialization of 'cond mud, circulate'.</description>
		</value>
		<value>
			<name>cond mud, circulate -- well control</name>
			<description>A specialization of 'cond mud, circulate'.</description>
		</value>
		<value>
			<name>coring</name>
			<description>coring</description>
		</value>
		<value>
			<name>coring -- conventional</name>
			<description>A specialization of 'coring'.</description>
		</value>
		<value>
			<name>coring -- flow check</name>
			<description>A specialization of 'coring'.</description>
		</value>
		<value>
			<name>coring -- laydown barrel</name>
			<description>A specialization of 'coring'.</description>
		</value>
		<value>
			<name>coring -- oriented</name>
			<description>A specialization of 'coring'.</description>
		</value>
		<value>
			<name>coring -- plastic sleeve</name>
			<description>A specialization of 'coring'.</description>
		</value>
		<value>
			<name>coring -- rig up core barrel</name>
			<description>A specialization of 'coring'.</description>
		</value>
		<value>
			<name>coring -- sponge</name>
			<description>A specialization of 'coring'.</description>
		</value>
		<value>
			<name>cut, slip drilling line</name>
			<description>cut and slip drilling line</description>
		</value>
		<value>
			<name>deviation survey</name>
			<description>deviation survey</description>
		</value>
		<value>
			<name>deviation survey -- dir multi-shot</name>
			<description>A specialization of 'deviation survey': directional multi-shot</description>
		</value>
		<value>
			<name>deviation survey -- dir single shot</name>
			<description>A specialization of 'deviation survey': directional single shot</description>
		</value>
		<value>
			<name>deviation survey -- drift</name>
			<description>A specialization of 'deviation survey'.</description>
		</value>
		<value>
			<name>deviation survey -- gyro</name>
			<description>A specialization of 'deviation survey'.</description>
		</value>
		<value>
			<name>deviation survey -- MWD</name>
			<description>A specialization of 'deviation survey'.</description>
		</value>
		<value>
			<name>dir work</name>
			<description>directional work</description>
		</value>
		<value>
			<name>dir work -- horizontal drilling</name>
			<description>A specialization of 'dir work'.</description>
		</value>
		<value>
			<name>dir work -- motor drilling</name>
			<description>A specialization of 'dir work'.</description>
		</value>
		<value>
			<name>dir work -- orient</name>
			<description>A specialization of 'dir work'.</description>
		</value>
		<value>
			<name>dir work -- rotary drilling</name>
			<description>A specialization of 'dir work'.</description>
		</value>
		<value>
			<name>dir work -- slant drilling</name>
			<description>A specialization of 'dir work'.</description>
		</value>
		<value>
			<name>DST</name>
			<description>drill stem test</description>
		</value>
		<value>
			<name>DST -- cased hole</name>
			<description>A specialization of 'DST'.</description>
		</value>
		<value>
			<name>DST -- lay down tools</name>
			<description>A specialization of 'DST'.</description>
		</value>
		<value>
			<name>DST -- open hole</name>
			<description>A specialization of 'DST'.</description>
		</value>
		<value>
			<name>DST -- open hole closed chamber</name>
			<description>A specialization of 'DST'.</description>
		</value>
		<value>
			<name>DST -- rig up tools</name>
			<description>A specialization of 'DST'.</description>
		</value>
		<value>
			<name>drilling</name>
			<description>drilling</description>
		</value>
		<value>
			<name>drilling -- casing</name>
			<description>A specialization of 'drilling'.</description>
		</value>
		<value>
			<name>drilling -- connection</name>
			<description>A specialization of 'drilling'.</description>
		</value>
		<value>
			<name>drilling -- drill cement, float equip</name>
			<description>A specialization of 'drilling': drill out cement and/or float equipment</description>
		</value>
		<value>
			<name>drilling -- flow check</name>
			<description>A specialization of 'drilling'.</description>
		</value>
		<value>
			<name>drilling -- hole opening</name>
			<description>A specialization of 'drilling'.</description>
		</value>
		<value>
			<name>drilling -- new hole</name>
			<description>A specialization of 'drilling'.</description>
		</value>
		<value>
			<name>drilling -- sidetracking</name>
			<description>A specialization of 'drilling'.</description>
		</value>
		<value>
			<name>drilling -- under-reaming</name>
			<description>A specialization of 'drilling'.</description>
		</value>
		<value>
			<name>fishing</name>
			<description>fishing</description>
		</value>
		<value>
			<name>fishing -- BHA</name>
			<description>A specialization of 'fishing'.</description>
		</value>
		<value>
			<name>fishing -- casing</name>
			<description>A specialization of 'fishing'.</description>
		</value>
		<value>
			<name>fishing -- cones</name>
			<description>>A specialization of 'fishing'.</description>
		</value>
		<value>
			<name>fishing -- other</name>
			<description>A specialization of 'fishing'.</description>
		</value>
		<value>
			<name>fishing -- stuck pipe</name>
			<description>A specialization of 'fishing'.</description>
		</value>
		<value>
			<name>fishing -- wireline tools</name>
			<description>A specialization of 'fishing'.</description>
		</value>
		<value>
			<name>HSE</name>
			<description>Health, Safety and Environmental</description>
		</value>